{
  "$schema": "https://llm-catalog.example.cn/schemas/models-dev-official-review.schema.json",
  "review_set_id": "models-dev-2026-official-review",
  "reviewed_at": "2026-08-02T00:00:00Z",
  "reviews": [
    {
      "canonical_id": "aion-labs/aion-2.0-20260223",
      "evidence": [
        {
          "confidence": "high",
          "notes": "Aion Labs 官方 API 参考明确列出 aion-labs/aion-2.0，且提供 OpenAI 兼容 Chat 与 Responses 端点。",
          "redistribution": "unknown",
          "retrieved_at": "2026-08-02T00:00:00Z",
          "source_id": "aion-labs-api-reference",
          "source_type": "official_api",
          "source_url": "https://api.aionlabs.ai/docs/api-reference/",
          "verified_at": "2026-08-02T00:00:00Z"
        }
      ],
      "observed_api_model_id": "aion-labs/aion-2.0",
      "offering_id": "aion-labs/aion-2.0-20260223",
      "official_api_model_id": "aion-labs/aion-2.0",
      "official_protocols": [
        "openai_chat_completions",
        "openai_responses"
      ],
      "provider_id": "aion-labs",
      "review_status": "official_api_verified",
      "reviewed_at": "2026-08-02T00:00:00Z",
      "runtime_disposition": "keep_fail_closed",
      "summary": "Aion Labs 官方 API 参考列出与 observed 相同的模型 ID，并说明 OpenAI 兼容 Chat 与 Responses 端点。",
      "verified_fields": [
        "model_identity",
        "api_model_id",
        "protocols"
      ]
    },
    {
      "canonical_id": "anthropic/claude-4.6-opus-20260205",
      "evidence": [
        {
          "confidence": "high",
          "notes": "Anthropic 模型概览列出 Claude API 的当前模型 ID、上下文与能力概览。",
          "redistribution": "unknown",
          "retrieved_at": "2026-08-02T00:00:00Z",
          "source_id": "anthropic-models-overview",
          "source_type": "official_docs",
          "source_url": "https://platform.claude.com/docs/en/about-claude/models/overview",
          "verified_at": "2026-08-02T00:00:00Z"
        },
        {
          "confidence": "high",
          "notes": "Anthropic 定价页说明 Opus 4.7 的 fast mode 是请求速度模式，并说明 Opus 4.6 fast 已不可用/下线。",
          "redistribution": "unknown",
          "retrieved_at": "2026-08-02T00:00:00Z",
          "source_id": "anthropic-pricing-fast-mode",
          "source_type": "official_docs",
          "source_url": "https://platform.claude.com/docs/en/about-claude/pricing",
          "verified_at": "2026-08-02T00:00:00Z"
        }
      ],
      "observed_api_model_id": "anthropic/claude-opus-4.6",
      "offering_id": "anthropic/claude-4.6-opus-20260205",
      "official_api_model_id": "claude-opus-4-6",
      "official_protocols": [
        "anthropic_messages"
      ],
      "provider_id": "anthropic",
      "review_status": "official_api_verified",
      "reviewed_at": "2026-08-02T00:00:00Z",
      "runtime_disposition": "keep_fail_closed",
      "summary": "官方文档使用 claude-opus-4-6 作为 API ID；目录原始 namespaced 观察值不直接进入构造器。",
      "verified_fields": [
        "model_identity",
        "api_model_id",
        "protocols"
      ]
    },
    {
      "canonical_id": "anthropic/claude-4.6-opus-fast-20260407",
      "evidence": [
        {
          "confidence": "high",
          "notes": "Anthropic 模型概览列出 Claude API 的当前模型 ID、上下文与能力概览。",
          "redistribution": "unknown",
          "retrieved_at": "2026-08-02T00:00:00Z",
          "source_id": "anthropic-models-overview",
          "source_type": "official_docs",
          "source_url": "https://platform.claude.com/docs/en/about-claude/models/overview",
          "verified_at": "2026-08-02T00:00:00Z"
        },
        {
          "confidence": "high",
          "notes": "Anthropic 定价页说明 Opus 4.7 的 fast mode 是请求速度模式，并说明 Opus 4.6 fast 已不可用/下线。",
          "redistribution": "unknown",
          "retrieved_at": "2026-08-02T00:00:00Z",
          "source_id": "anthropic-pricing-fast-mode",
          "source_type": "official_docs",
          "source_url": "https://platform.claude.com/docs/en/about-claude/pricing",
          "verified_at": "2026-08-02T00:00:00Z"
        }
      ],
      "observed_api_model_id": "anthropic/claude-opus-4.6-fast",
      "offering_id": "anthropic/claude-4.6-opus-fast-20260407",
      "official_api_model_id": "claude-opus-4-6",
      "official_protocols": [
        "anthropic_messages"
      ],
      "provider_id": "anthropic",
      "review_status": "official_route_unavailable",
      "reviewed_at": "2026-08-02T00:00:00Z",
      "runtime_disposition": "keep_fail_closed",
      "summary": "官方说明 Claude Opus 4.6 的 fast mode 已不可用/下线。该上游路线不得作为新租户部署或运行时模型选择。",
      "verified_fields": [
        "model_identity",
        "api_model_id"
      ]
    },
    {
      "canonical_id": "anthropic/claude-4.6-sonnet-20260217",
      "evidence": [
        {
          "confidence": "high",
          "notes": "Anthropic 模型概览列出 Claude API 的当前模型 ID、上下文与能力概览。",
          "redistribution": "unknown",
          "retrieved_at": "2026-08-02T00:00:00Z",
          "source_id": "anthropic-models-overview",
          "source_type": "official_docs",
          "source_url": "https://platform.claude.com/docs/en/about-claude/models/overview",
          "verified_at": "2026-08-02T00:00:00Z"
        }
      ],
      "observed_api_model_id": "anthropic/claude-sonnet-4.6",
      "offering_id": "anthropic/claude-4.6-sonnet-20260217",
      "official_api_model_id": "claude-sonnet-4-6",
      "official_protocols": [
        "anthropic_messages"
      ],
      "provider_id": "anthropic",
      "review_status": "official_api_verified",
      "reviewed_at": "2026-08-02T00:00:00Z",
      "runtime_disposition": "keep_fail_closed",
      "summary": "官方文档使用 claude-sonnet-4-6 作为 API ID；目录原始 namespaced 观察值不直接进入构造器。",
      "verified_fields": [
        "model_identity",
        "api_model_id",
        "protocols"
      ]
    },
    {
      "canonical_id": "anthropic/claude-4.7-opus-20260416",
      "evidence": [
        {
          "confidence": "high",
          "notes": "Anthropic 模型概览列出 Claude API 的当前模型 ID、上下文与能力概览。",
          "redistribution": "unknown",
          "retrieved_at": "2026-08-02T00:00:00Z",
          "source_id": "anthropic-models-overview",
          "source_type": "official_docs",
          "source_url": "https://platform.claude.com/docs/en/about-claude/models/overview",
          "verified_at": "2026-08-02T00:00:00Z"
        }
      ],
      "observed_api_model_id": "anthropic/claude-opus-4.7",
      "offering_id": "anthropic/claude-4.7-opus-20260416",
      "official_api_model_id": "claude-opus-4-7",
      "official_protocols": [
        "anthropic_messages"
      ],
      "provider_id": "anthropic",
      "review_status": "official_api_verified",
      "reviewed_at": "2026-08-02T00:00:00Z",
      "runtime_disposition": "keep_fail_closed",
      "summary": "官方 API ID 使用连字符形式 claude-opus-4-7；observed namespaced ID 不是可直接发送的最终请求值。",
      "verified_fields": [
        "model_identity",
        "api_model_id",
        "protocols"
      ]
    },
    {
      "canonical_id": "anthropic/claude-4.7-opus-fast-20260512",
      "evidence": [
        {
          "confidence": "high",
          "notes": "Anthropic 模型概览列出 Claude API 的当前模型 ID、上下文与能力概览。",
          "redistribution": "unknown",
          "retrieved_at": "2026-08-02T00:00:00Z",
          "source_id": "anthropic-models-overview",
          "source_type": "official_docs",
          "source_url": "https://platform.claude.com/docs/en/about-claude/models/overview",
          "verified_at": "2026-08-02T00:00:00Z"
        },
        {
          "confidence": "high",
          "notes": "Anthropic 定价页说明 Opus 4.7 的 fast mode 是请求速度模式，并说明 Opus 4.6 fast 已不可用/下线。",
          "redistribution": "unknown",
          "retrieved_at": "2026-08-02T00:00:00Z",
          "source_id": "anthropic-pricing-fast-mode",
          "source_type": "official_docs",
          "source_url": "https://platform.claude.com/docs/en/about-claude/pricing",
          "verified_at": "2026-08-02T00:00:00Z"
        }
      ],
      "observed_api_model_id": "anthropic/claude-opus-4.7-fast",
      "offering_id": "anthropic/claude-4.7-opus-fast-20260512",
      "official_api_model_id": "claude-opus-4-7",
      "official_protocols": [
        "anthropic_messages"
      ],
      "provider_id": "anthropic",
      "review_status": "official_api_verified",
      "reviewed_at": "2026-08-02T00:00:00Z",
      "runtime_disposition": "keep_fail_closed",
      "summary": "官方将 Opus 4.7 fast 表示为 claude-opus-4-7 的 speed 请求变体，而不是独立模型 ID。保留上游 route 名称仅供审计；未补齐当前项目的 speed 参数映射和契约测试前，运行时保持 fail-closed。",
      "verified_fields": [
        "model_identity",
        "api_model_id",
        "protocols"
      ]
    },
    {
      "canonical_id": "arcee-ai/trinity-large-preview",
      "evidence": [
        {
          "confidence": "high",
          "notes": "Arcee 官方模型发布说明 Trinity-Large-Preview 的模型身份、上下文和发布渠道。",
          "redistribution": "unknown",
          "retrieved_at": "2026-08-02T00:00:00Z",
          "source_id": "arcee-trinity-large-preview",
          "source_type": "official_docs",
          "source_url": "https://www.arcee.ai/blog/trinity-large",
          "verified_at": "2026-08-02T00:00:00Z"
        }
      ],
      "observed_api_model_id": "arcee-ai/trinity-large-preview",
      "offering_id": "arcee-ai/trinity-large-preview",
      "official_api_model_id": "unknown",
      "official_protocols": "unknown",
      "provider_id": "arcee-ai",
      "review_status": "official_model_verified",
      "reviewed_at": "2026-08-02T00:00:00Z",
      "runtime_disposition": "keep_fail_closed",
      "summary": "Arcee 官方发布页确认 Trinity-Large-Preview 的模型身份，但没有把其第三方路由名提升为 Arcee 直连 API offering。",
      "verified_fields": [
        "model_identity"
      ]
    },
    {
      "canonical_id": "arcee-ai/trinity-large-thinking",
      "evidence": [
        {
          "confidence": "high",
          "notes": "Arcee 官方发布说明 Trinity-Large-Thinking 已在其 API 和权重仓库发布。",
          "redistribution": "unknown",
          "retrieved_at": "2026-08-02T00:00:00Z",